Start Date,End Date,Program Title,Faculty Director,Term,Number of Participants,Country,Countries Visited,Photos
1983/06,1983/08,Economics Seminar In Cambridge,Martha Paas,Summer,21,UK,UK
1983/12,1984/03,English Seminar In London,George Soule,Winter,26,UK,UK
1984/03,1984/06,French Language In Pau I,Debbie Glassman,Spring,24,France,France
1984/03,1984/06,French Language In Pau II,Gail Schwab,Winter/Spring,9,France,France
1983/12,1984/03,Geology In Death Valley,Mary Savina & M. Hempton,Winter,24,USA,USA
1983/08,1983/11,German Seminar In Nuremberg,Roger Paas,Fall,20,Germany,Germany
1983/06,1983/08,International Relations Seminar In Geneva,Hartley Clark,Summer,25,Switzerland,Switzerland
1983/08,1983/11,Marine Biology Seminar In California,Gary Wagenbach,Fall,22,USA,USA
1983/12,1984/03,Spanish Seminar In Morelia,Becky Boling,Winter,9,Mexico,Mexico
