Start Date,End Date,Program Title,Faculty Director,Term,Number of Participants,Country,Countries Visited,Photos
1993/06,1993/08,Economics Seminar In Cambridge,Mike Hemesath,Summer,23,UK,UK
1993/12,1994/03,English & Psychology Seminar In London,Constance Walker & Neil Lutsky,Winter,33,UK,UK
1994/03,1994/06,French Language In Pau I,Éva Pósfay,Spring,18,France,France
1994/03,1994/06,French Seminar In Paris,Chérif Keïta,Spring,23,France,France
1993/08,1993/11,Geology Seminar In Italy,David Bice,Fall,23,Italy,Italy
1993/08,1993/11,"German Seminar In Graz, Austria",Anne Uimer,Fall,17,Austria,Austria
1993/12,1994/03,Marine Biology Seminar In Australia & New Zealand,Gary Wagenbach,Winter,25,Australia,"Australia, New Zealand"
1993/06,1993/08,Political Science Seminar In Maastricht,Gary Wynia,Summer,22,The Netherlands,The Netherlands
1993/12,1994/03,Spanish Seminar In Morelia,Diane Pearsall,Winter,21,Mexico,Mexico
